{
  "date": "2019-04-27",
  "team": "FC Barcelone",
  "opponent": "Levante UD",
  "competition": "Liga",
  "city": "",
  "stadium": "Spotify Camp Nou",
  "minute": 61,
  "bodyPart": "Pied gauche",
  "goalType": "En jeu",
  "position": "Dans la surface",
  "placement": "",
  "assist": "Arturo Erasmo Vidal Pardo",
  "goalkeeper": "Aitor Fernández Abarisketa",
  "videoUrl": "",
  "source": "StatsBomb Open Data (github.com/statsbomb/open-data)",
  "contributor": "MessiGoal (import StatsBomb)"
}
