{
  "date": "2012-03-20",
  "team": "FC Barcelone",
  "opponent": "Granada",
  "competition": "Liga",
  "city": "",
  "stadium": "Spotify Camp Nou",
  "minute": 85,
  "bodyPart": "Pied gauche",
  "goalType": "En jeu",
  "position": "Dans la surface",
  "placement": "",
  "assist": "Daniel Alves da Silva",
  "goalkeeper": "Júlio César Jacobi",
  "videoUrl": "",
  "source": "StatsBomb Open Data (github.com/statsbomb/open-data)",
  "contributor": "MessiGoal (import StatsBomb)"
}
