{
  "date": "2014-09-27",
  "team": "FC Barcelone",
  "opponent": "Granada",
  "competition": "Liga",
  "city": "",
  "stadium": "Spotify Camp Nou",
  "minute": 81,
  "bodyPart": "Pied droit",
  "goalType": "En jeu",
  "position": "Dans la surface",
  "placement": "",
  "assist": "",
  "goalkeeper": "Roberto Fernández Alvarellos",
  "videoUrl": "",
  "source": "StatsBomb Open Data (github.com/statsbomb/open-data)",
  "contributor": "MessiGoal (import StatsBomb)"
}
