{
  "date": "2014-12-07",
  "team": "FC Barcelone",
  "opponent": "Espanyol",
  "competition": "Liga",
  "city": "",
  "stadium": "Spotify Camp Nou",
  "minute": 49,
  "bodyPart": "Pied droit",
  "goalType": "En jeu",
  "position": "Dans la surface",
  "placement": "",
  "assist": "Luis Alberto Suárez Díaz",
  "goalkeeper": "Francisco Casilla Cortés",
  "videoUrl": "",
  "source": "StatsBomb Open Data (github.com/statsbomb/open-data)",
  "contributor": "MessiGoal (import StatsBomb)"
}
