{
  "date": "2016-04-17",
  "team": "FC Barcelone",
  "opponent": "Valencia",
  "competition": "Liga",
  "city": "",
  "stadium": "Spotify Camp Nou",
  "minute": 62,
  "bodyPart": "Pied gauche",
  "goalType": "En jeu",
  "position": "Dans la surface",
  "placement": "",
  "assist": "Jordi Alba Ramos",
  "goalkeeper": "Diego Alves Carreira",
  "videoUrl": "",
  "source": "StatsBomb Open Data (github.com/statsbomb/open-data)",
  "contributor": "MessiGoal (import StatsBomb)"
}
