{
  "date": "2016-11-27",
  "team": "FC Barcelone",
  "opponent": "Real Sociedad",
  "competition": "Liga",
  "city": "",
  "stadium": "Reale Arena",
  "minute": 58,
  "bodyPart": "Pied gauche",
  "goalType": "En jeu",
  "position": "Dans la surface",
  "placement": "",
  "assist": "Neymar da Silva Santos Junior",
  "goalkeeper": "Gerónimo Rulli",
  "videoUrl": "",
  "source": "StatsBomb Open Data (github.com/statsbomb/open-data)",
  "contributor": "MessiGoal (import StatsBomb)"
}
