{
  "date": "2007-06-05",
  "team": "Argentine",
  "opponent": "Algérie",
  "competition": "Match amical",
  "city": "Barcelone",
  "stadium": "Camp Nou",
  "minute": null,
  "bodyPart": "",
  "goalType": "",
  "position": "",
  "placement": "",
  "assist": "",
  "goalkeeper": "",
  "videoUrl": "",
  "source": "https://en.wikipedia.org/wiki/List_of_international_goals_scored_by_Lionel_Messi",
  "contributor": "MessiGoal"
}
