{
  "date": "2015-02-15",
  "team": "FC Barcelone",
  "opponent": "Levante UD",
  "competition": "Liga",
  "city": "",
  "stadium": "Spotify Camp Nou",
  "minute": 58,
  "bodyPart": "Pied droit",
  "goalType": "En jeu",
  "position": "Dans la surface",
  "placement": "",
  "assist": "Pedro Eliezer Rodríguez Ledesma",
  "goalkeeper": "Diego Mariño Villar",
  "videoUrl": "",
  "source": "StatsBomb Open Data (github.com/statsbomb/open-data)",
  "contributor": "MessiGoal (import StatsBomb)"
}
