{
  "date": "2017-04-23",
  "team": "FC Barcelone",
  "opponent": "Real Madrid",
  "competition": "Liga",
  "city": "",
  "stadium": "Bernabéu",
  "minute": 91,
  "bodyPart": "Pied gauche",
  "goalType": "En jeu",
  "position": "Dans la surface",
  "placement": "",
  "assist": "Jordi Alba Ramos",
  "goalkeeper": "Keylor Navas Gamboa",
  "videoUrl": "",
  "source": "StatsBomb Open Data (github.com/statsbomb/open-data)",
  "contributor": "MessiGoal (import StatsBomb)"
}
