{
  "date": "2018-12-16",
  "team": "FC Barcelone",
  "opponent": "Levante UD",
  "competition": "Liga",
  "city": "",
  "stadium": "Estadio Ciudad de Valencia",
  "minute": 59,
  "bodyPart": "Pied gauche",
  "goalType": "En jeu",
  "position": "Dans la surface",
  "placement": "",
  "assist": "Arturo Erasmo Vidal Pardo",
  "goalkeeper": "Oier Olazábal Paredes",
  "videoUrl": "",
  "source": "StatsBomb Open Data (github.com/statsbomb/open-data)",
  "contributor": "MessiGoal (import StatsBomb)"
}
