{
  "date": "2015-01-18",
  "team": "FC Barcelone",
  "opponent": "RC Deportivo La Coruña",
  "competition": "Liga",
  "city": "",
  "stadium": "Estadio Abanca-Riazor",
  "minute": 61,
  "bodyPart": "Pied gauche",
  "goalType": "En jeu",
  "position": "Dans la surface",
  "placement": "",
  "assist": "Daniel Alves da Silva",
  "goalkeeper": "Fabricio Martín Agosto Ramírez",
  "videoUrl": "",
  "source": "StatsBomb Open Data (github.com/statsbomb/open-data)",
  "contributor": "MessiGoal (import StatsBomb)"
}
